{
  "$schema": "https://json-schema.org/draft/2020-12/schema",
  "$id": "https://video2pdf.local/schemas/video-workflow/v1/run-record.v1.schema.json",
  "type": "object",
  "additionalProperties": false,
  "required": ["schema_name", "schema_version", "kernel_version", "scaffold_version", "run_id", "request_id", "platform_adapter", "canonical_item_id", "original_title", "normalized_title", "task_start", "output_path", "deliverable_version", "version_basis", "source_acquisition_mode", "phase", "initialization_intent_id", "coordination_revision", "artifact_plan", "artifact_generations", "checkpoints"],
  "properties": {
    "schema_name": {"const": "run-record"},
    "schema_version": {"const": "1.0.0"},
    "kernel_version": {"const": "2.0.0"},
    "scaffold_version": {"const": "1.0.0"},
    "run_id": {"$ref": "https://video2pdf.local/schemas/video-workflow/v1/common.v1.schema.json#/$defs/run_id"},
    "request_id": {"type": "string", "minLength": 1},
    "platform_adapter": {"const": "fixture"},
    "canonical_item_id": {"type": "string", "minLength": 1},
    "original_title": {"type": "string", "minLength": 1},
    "normalized_title": {"type": "string", "minLength": 1},
    "task_start": {"type": "string", "format": "date-time"},
    "output_path": {"$ref": "https://video2pdf.local/schemas/video-workflow/v1/common.v1.schema.json#/$defs/absolute_path"},
    "deliverable_version": {"const": 1},
    "version_basis": {"const": "source_only"},
    "source_acquisition_mode": {"const": "verified_import"},
    "phase": {"enum": ["initializing", "source_ready"]},
    "initialization_intent_id": {"type": "string", "minLength": 1},
    "coordination_revision": {"type": "integer", "minimum": 1},
    "artifact_plan": {"const": "workflow/artifact-plan.json"},
    "artifact_generations": {
      "type": "object", "additionalProperties": false,
      "required": ["source_manifest"],
      "properties": {
        "source_manifest": {
          "type": "object", "additionalProperties": false,
          "required": ["path", "generation", "sha256", "producer"],
          "properties": {
            "path": {"const": "source/manifest.json"},
            "generation": {"const": 1},
            "sha256": {"$ref": "https://video2pdf.local/schemas/video-workflow/v1/common.v1.schema.json#/$defs/sha256"},
            "producer": {"const": "kernel:verified-import"}
          }
        }
      }
    },
    "checkpoints": {
      "type": "object", "additionalProperties": false,
      "required": ["source_ready"],
      "properties": {
        "source_ready": {
          "type": "object", "additionalProperties": false,
          "required": ["status", "artifact_generations", "evidence_sha256"],
          "properties": {
            "status": {"enum": ["current", "stale"]},
            "artifact_generations": {"const": {"source_manifest": 1}},
            "evidence_sha256": {"$ref": "https://video2pdf.local/schemas/video-workflow/v1/common.v1.schema.json#/$defs/sha256"}
          }
        }
      }
    }
  }
}
