{"schema_name":"run-record","schema_version":"1.0.0","kernel_version":"2.0.0","scaffold_version":"1.0.0","run_id":"00000000000000000000000000000000","request_id":"example","platform_adapter":"fixture","canonical_item_id":"offline-source-ready-001","original_title":"A","normalized_title":"A","task_start":"2026-07-15T01:02:03+08:00","output_path":"D:\\workspace\\A_20260715_010203","deliverable_version":1,"version_basis":"source_only","source_acquisition_mode":"verified_import","phase":"source_ready","initialization_intent_id":"intent-example","coordination_revision":1,"artifact_plan":"workflow/artifact-plan.json","artifact_generations":{"source_manifest":{"path":"source/manifest.json","generation":1,"sha256":"0000000000000000000000000000000000000000000000000000000000000000","producer":"kernel:verified-import"}},"checkpoints":{"source_ready":{"status":"current","artifact_generations":{"source_manifest":1},"evidence_sha256":"0000000000000000000000000000000000000000000000000000000000000000"}}}
